data/data_for_sam3_post/detection_attributes.csv

detected_object,confidence,object_index,accept,healthy,damaged,vcuts,dead,crowd,occluded,other_problem
2,0.842,16,True,False,True,False,False,False,False,False
3,0.771,5,False,True,False,False,False,True,False,False
4,0.764,9,True,False,True,False,False,False,False,False
5,0.743,3,False,True,False,False,False,False,True,False
6,0.73,12,True,False,True,False,False,False,False,False
7,0.699,2,True,False,True,False,False,False,False,False
8,0.691,20,False,False,False,False,False,False,True,False
9,0.678,7,True,False,True,False,False,False,False,False
10,0.65,0,True,False,True,False,False,False,False,False
11,0.63,24,False,False,False,False,False,True,False,False
12,0.616,8,True,False,True,True,False,False,False,False
13,0.568,22,True,False,True,False,False,False,False,False
14,0.535,15,False,False,False,False,False,False,True,False
15,0.511,14,True,False,False,False,True,False,False,False
16,0.48,4,True,False,False,False,True,False,False,False
17,0.47,11,False,True,False,False,False,False,True,False
18,0.458,10,True,False,True,True,False,False,False,False
19,0.412,21,False,False,False,False,False,False,True,False
20,0.402,19,False,False,False,False,False,False,True,False
21,0.397,23,False,False,False,False,False,False,True,False
22,0.348,6,False,False,False,False,False,False,True,False
23,0.344,18,False,False,False,False,False,True,False,False
24,0.32,13,False,False,False,False,False,False,True,False
25,0.281,17,False,False,False,False,False,True,False,False
26,0.26,1,False,False,False,False,False,False,True,False

sam3.md

### Attributes

- [x] accept
- [] healthy
- [x] damaged
- [] vcuts
- [] dead
- [] crowd
- [] occluded
- [] other_problem
---
## Detected object 03 confidence: 0.771 object_index: 5

- [x] accept
- [] healthy
- [x] damaged
- [] vcuts
- [] dead
- [] crowd
- [] occluded
- [] other_problem
---
## Detected object 07 confidence: 0.699 object_index: 2

- [x] accept
- [] healthy
- [x] damaged
- [] vcuts
- [] dead
- [] crowd
- [] occluded
- [] other_problem
---
## Detected object 08 confidence: 0.691 object_index: 20

- [] accept
- [] healthy
- [] damaged
- [] vcuts
- [] dead
- [] crowd
- [x] occluded
- [] other_problem
---
## Detected object 09 confidence: 0.678 object_index: 7

- [] accept
- [] healthy
- [] damaged
- [] vcuts
- [] dead
- [x] crowd
- [] occluded
- [] other_problem
---
## Detected object 12 confidence: 0.616 object_index: 8

- [x] accept
- [] healthy
- [x] damaged
- [x] vcuts
- [] dead
- [] crowd
- [] occluded
- [] other_problem
---
## Detected object 13 confidence: 0.568 object_index: 22

- [x] accept
- [] healthy
- [x] damaged
- [] vcuts
- [] dead
- [] crowd
- [] occluded
- [] other_problem
---
## Detected object 14 confidence: 0.535 object_index: 15

- [] accept
- [] healthy
- [] damaged
- [] vcuts
- [] dead
- [] crowd
- [x] occluded
- [] other_problem
---
## Detected object 15 confidence: 0.511 object_index: 14

- [] accept
- [x] healthy
- [] damaged
- [] vcuts
- [] dead
- [] crowd
- [x] occluded
- [] other_problem
---
## Detected object 18 confidence: 0.458 object_index: 10

- [x] accept
- [] healthy
- [x] damaged
- [x] vcuts
- [] dead
- [] crowd
- [] occluded
- [] other_problem
---
## Detected object 19 confidence: 0.412 object_index: 21

- [] accept
- [] healthy
- [] damaged
- [] vcuts
- [] dead
- [] crowd
- [x] occluded
- [] other_problem
---
## Detected object 20 confidence: 0.402 object_index: 19

- [] accept
- [] healthy
- [] damaged
- [] vcuts
- [] dead
- [] crowd
- [x] occluded
- [] other_problem
---
## Detected object 21 confidence: 0.397 object_index: 23

- [] accept
- [] healthy
- [] damaged
- [] vcuts
- [] dead
- [] crowd
- [x] occluded
- [] other_problem
---
## Detected object 22 confidence: 0.348 object_index: 6

- [] accept
- [] healthy
- [] damaged
- [] vcuts
- [] dead
- [] crowd
- [x] occluded
- [] other_problem
---
## Detected object 23 confidence: 0.344 object_index: 18

- [] accept
- [] healthy
- [] damaged
- [] vcuts
- [] dead
- [] crowd
- [x] occluded
- [] other_problem
---
## Detected object 25 confidence: 0.281 object_index: 17